{
	"$schema": "./project.schema.json",
	"slug": "slice",
	"tile": {
		"title": "React UI Kit",
		"type": "Systems & SDKs",
		"logo": {
			"type": "logo",
			"name": "slice",
			"size": 28,
			"color": "#00edff"
		},
		"image": "/projects/slicebg.png",
		"titleColor": "#ffffff",
		"typeColor": "rgba(0,0,0,0.3)",
		"order": 1
	},
	"ai": {
		"summary": "Slice is a React UI SDK and browser runtime library that combines a design system, component library, and abstractions over complex browser and realtime APIs into one composable package.",
		"tagline": "A single package for theme, UI, browser APIs, and realtime product building.",
		"emphasize": [
			"Composability across UI, stores, hooks, and browser APIs",
			"Single-package design system and runtime model",
			"Granular export strategy and build engineering",
			"SSR and framework compatibility",
			"Real-world authoring and maintenance work, not just component demos"
		],
		"avoid": [
			"Describing it as only a component library",
			"Reducing the project to visuals without mentioning architecture",
			"Overstating maturity beyond the current pre-1.0 state"
		],
		"audiences": ["Frontend engineers", "Hiring managers", "Technical founders"],
		"suggestedQuestions": [
			"What problem does Slice solve better than combining multiple libraries?",
			"How does the export map and build system work?",
			"What makes the theming model different?",
			"How does Slice handle browser APIs and WebRTC?"
		],
		"capabilities": ["summarize", "explain_architecture", "highlight_tradeoffs", "compare"],
		"limitations": [
			"Do not imply production scale beyond what is explicitly documented",
			"Do not invent components or API features not present in the project content"
		],
		"highlightOrder": [
			"Single-package model",
			"Composable API surface",
			"Granular exports and build system",
			"Realtime and browser APIs",
			"SSR compatibility"
		],
		"relatedProjects": ["uris-design"],
		"keywords": ["React", "design system", "component library", "WebRTC", "Rollup", "SSR"]
	},
	"header": {
		"brand": {
			"type": "logo",
			"name": "slice",
			"color": "#00a6c0",
			"size": 32,
			"margin": "0 0 32px 0"
		},
		"title": "React UI SDK",
		"subtitle": "Design language, component library, and browser API layer — all in one npm package. \"Because piecing together multiple libraries to ship one feature stopped making sense.\"",
		"techStack": [
			"React 18/19",
			"TypeScript",
			"npm",
			"Storybook",
			"Rollup",
			"PostCSS",
			"Vitest + Playwright",
			"Zustand",
			"Motion",
			"Biome",
			"SSR + client",
			"WebRTC",
			"Open source"
		],
		"links": [
			{
				"label": "www.slice-uikit.com",
				"href": "https://www.slice-uikit.com",
				"iconLeft": "globe location",
				"target": "_blank"
			},
			{
				"label": "npm",
				"href": "https://www.npmjs.com/package/@apple-pie/slice",
				"iconLeft": "npm",
				"target": "_blank"
			},
			{
				"label": "GitHub",
				"href": "https://github.com/uris/uikit",
				"iconLeft": "github",
				"target": "_blank"
			}
		],
		"carousel": {
			"maxImageHeight": 325,
			"items": [
				{
					"title": "Realtime right out-of-the box",
					"description": "Production-ready abstractions over WebRTC, WebSocket, and SSE — video, audio, screen sharing, and live data streams without the boilerplate.",
					"image": "cameraDemo",
					"imageLight": "cameraDemoLight"
				},
				{
					"title": "Complete design system",
					"description": "A design language built into a single React provider. Fully customizable token system across colors, spacing, motion, typography, icons, and more.",
					"image": "themeColors",
					"imageLight": "themeColorsLight",
					"imagePos": "left"
				},
				{
					"title": "Everything composes",
					"description": "Types flow between layers so the pieces fit together. Hooks return types the components already expect — less wiring, less glue code, more product.",
					"image": "sliceCode"
				},
				{
					"title": "Built to be lean",
					"description": "98 granular export paths mean your bundle only includes what you actually use. Import from the root or go granular — tree-shaking handles the rest.",
					"image": "sliceRollupCode"
				},
				{
					"title": "SSR ready, zero config",
					"description": "Full SSR and static rendering support for Next.js and Remix, out of the box. No wrappers, no workarounds — it just works.",
					"image": "sliceSSR"
				}
			]
		}
	},
	"sections": [
		{
			"title": "The Problem",
			"icon": "moon full",
			"blocks": [
				{
					"type": "paragraph",
					"text": "Most frontend projects need the same things: a design system, a component library, and abstractions over complex APIs like WebRTC, etc. The typical answer - use multiple packages, none of which \"speak\" each other."
				},
				{
					"type": "paragraph",
					"text": "Result? Wasted time (often days) wiring them together, wrangling types, writing glue code — before actually producing product logic."
				}
			]
		},
		{
			"title": "Philosophy",
			"icon": "moon full",
			"blocks": [
				{
					"type": "paragraph",
					"text": "Composability. Everything is designed to interlock. Types flow from one layer to the next, stores abstract boiler plate, and hooks bind elements auto-magically."
				},
				{
					"type": "code",
					"language": "typescript",
					"title": "List and choose a microphone device in 2 lines",
					"snippet": "addMic"
				}
			]
		},
		{
			"title": "What's in the package",
			"icon": "moon full",
			"blocks": [
				{
					"type": "list",
					"items": [
						{
							"label": "Complete theme system",
							"text": "Design language coded into a single React provider, with a fully customizable token system across colors, spacing, motion, icons, type ..."
						},
						{
							"label": "40+ components",
							"text": "inputs, layout, media, overlays, and upload handling with a shared theme token system (colors, spacing, motion, type)"
						},
						{
							"label": "Real-time communication layer",
							"text": "production-grade abstractions over WebRTC, WebSocket, and SSE. ICE negotiation, reconnection logic, and typed event handlers handled for you"
						},
						{
							"label": "Browser API hooks",
							"text": "microphone, camera, screen share, IndexedDB, and audio visualisation, audio recording, each exposing clean React interfaces with automatic cleanup"
						},
						{
							"label": "SSR compatible",
							"text": "full React 18/19 RSC support, with 'use client' directives preserved through the build so Next.js and Remix apps work without configuration"
						},
						{
							"label": "Performance optimized",
							"text": "Abstracted web workers for threading uploads and components designed with fast mount / re-mount times of no more than 2 ms."
						}
					]
				}
			]
		},
		{
			"title": "A hard problem - the build system",
			"icon": "moon full",
			"blocks": [
				{
					"type": "paragraph",
					"text": "The package ships 98 granular export paths so consumers only pay for what they use. Getting that to work — dual CJS/ESM output, matching TypeScript definitions, and correct chunk splitting — required writing custom Rollup config that generates every entry point dynamically."
				},
				{
					"type": "paragraph",
					"text": "Tradeoff: longer build times but dramatically smaller footprint on the consuming side. Worth it."
				},
				{
					"type": "code",
					"language": "typescript",
					"title": "Granular imports",
					"snippet": "granularExports"
				}
			]
		},
		{
			"title": "By The Numbers",
			"icon": "moon full",
			"blocks": [
				{
					"type": "stats",
					"items": [
						{
							"value": "40+",
							"label": "Components"
						},
						{
							"value": "98",
							"label": "Export paths"
						},
						{
							"value": "34",
							"label": "npm releases"
						},
						{
							"value": "13+",
							"label": "Custom hooks"
						},
						{
							"value": "3",
							"label": "RT protocols"
						},
						{
							"value": "v0.1",
							"label": "Active / pre-1.0"
						}
					]
				}
			]
		},
		{
			"title": "Lessons learned",
			"icon": "moon full",
			"blocks": [
				{
					"type": "paragraph",
					"text": "Abstracting WebRTC properly meant understanding it deeply first — ICE negotiation, track replacement without renegotiation, data channel lifecycle. The API surface had to hide that complexity without hiding control. Getting that balance right took several iterations."
				},
				{
					"type": "paragraph",
					"text": "I also underestimated how much of the work in a public package is the documentation and DX, not the code. The Storybook site, documentation, the contributor guides, the export map — that's more than half the work."
				}
			]
		},
		{
			"title": "My Role",
			"icon": "moon full",
			"blocks": [
				{
					"type": "paragraph",
					"text": "Sole author and maintainer — component API design, build engineering, documentation, CI/CD, and the npm publishing lifecycle across 34 releases."
				}
			]
		}
	]
}
